,listing_url,last_scraped,source,name,description,neighborhood_overview,picture_url,host_url,host_name,host_since,host_location,host_about,host_response_time,host_response_rate,host_acceptance_rate,host_is_superhost,host_thumbnail_url,host_picture_url,host_neighbourhood,host_verifications,host_has_profile_pic,host_identity_verified,neighbourhood,neighbourhood_cleansed,property_type,room_type,bathrooms_text,amenities,price,has_availability,calendar_last_scraped,first_review,last_review,license,instant_bookable,id,scrape_id,host_id,host_listings_count,host_total_listings_count,latitude,longitude,accommodates,bedrooms,beds,minimum_nights,maximum_nights,minimum_minimum_nights,maximum_minimum_nights,minimum_maximum_nights,maximum_maximum_nights,minimum_nights_avg_ntm,maximum_nights_avg_ntm,availability_30,availability_60,availability_90,availability_365,number_of_reviews,number_of_reviews_ltm,number_of_reviews_l30d,review_scores_rating,review_scores_accuracy,review_scores_cleanliness,review_scores_checkin,review_scores_communication,review_scores_location,review_scores_value,calculated_host_listings_count,calculated_host_listings_count_entire_homes,calculated_host_listings_count_private_rooms,calculated_host_listings_count_shared_rooms,reviews_per_month
5759,https://www.airbnb.com/rooms/642886705473802703,06/03/2023,city scrape,Lovely 1-bedroom apartment with patio,Beautiful 1-bedroom perfect for the family who wants to be part of the local action.,Sin datos,https://a0.muscache.com/pictures/miso/Hosting-642886705473802703/original/13f4a7ec-d400-493b-80eb-498350d9fa4c.jpeg,https://www.airbnb.com/users/show/32878131,Michelle,08/05/2015,"Los Angeles, CA","I'm married and when I'm not traveling on business, I travel everywhere with my husband and 2 toddler kids. We LOVE exploring new cities, great food, and do tons of outdoors stuff like hiking, mountain biking & snowboarding, to name a few. When we travel, we prefer to hang out with the locals and learn more about what it's like living in a particular place. Doing the touristy thing can get old. 

To get us as guests, rest assured, we treat every place we stay in like it's our own. We love cleanliness and tidyness and we have always left our accommodations in the same or better condition than when we arrived, be it a hotel, or a vacation rental. 

We had opened up our home to international students and travelers and we welcomed them like they were part of our family. We also own 2 rental properties and we consider our tenants to be our partners in taking care of our homes. Being a host and a landlord has definitely allowed us to see the airbnb home rental process from both angles. 

We believe that we what we put out in the world, is what we get back.  So we aim to treat others as we would like to be treated, and that includes having respect for other people's properties. ",Sin datos,Sin datos,0.0,f,https://a0.muscache.com/im/users/32878131/profile_pic/1431064844/original.jpg?aki_policy=profile_small,https://a0.muscache.com/im/users/32878131/profile_pic/1431064844/original.jpg?aki_policy=profile_x_medium,Westchester/Playa Del Rey,"['email', 'phone']",t,t,Sin datos,Bernal Heights,Entire rental unit,Entire home/apt,1 bath,"[""Carbon monoxide alarm"", ""Security cameras on property"", ""Paid parking on premises"", ""Outdoor shower"", ""TV"", ""Dedicated workspace"", ""Air conditioning"", ""Washer"", ""First aid kit"", ""Smoke alarm"", ""Fire extinguisher"", ""Wifi"", ""Kitchen""]",14000.0,t,06/03/2023,Sin datos,Sin datos,Sin datos,f,27790615.3,20200000000000.0,32878131.0,3.0,6.0,37.73259,-122.43337,4.0,1.0,2.0,60.0,365.0,60.0,60.0,365.0,365.0,60.0,365.0,30,60,90,364,0.0,0.0,0.0,4.8,4.8,4.8,4.9,4.9,4.8,4.7,1.0,1.0,0.0,0.0,1.3
6490,https://www.airbnb.com/rooms/785698957007308545,06/03/2023,city scrape,Park Presidio,"Newly remodeled and economical two bedroom.  Well outfitted kitchen.  New bathroom.  Lots of natural light.  Close to public transport, restaurants and shops. Near the Presidio and Golden Gate Park. Near lively Clement Street.<br /><br /><b>The space</b><br />Our Park Presidio is a newly remodeled and economical two bedroom apartment located conveniently on a major San Francisco street.  The apartment boasts a very pleasant and light living room with wood floors.  There is a small but well outfitted kitchen and a very pleasant bathroom.  The master bedroom also has great natural light.<br />The apartment is located conveniently on Geary Street very close to numerous shopping and dining options.  It is a quick walk to Clement Street with it’s vast array of Asian restaurants and super markets.  The Presidio and Golden Gate Park are both close by.  The Golden Gate Bridge is a short distance as is a very nice public library.<br />Public transport is just outside your door, making it easy t",Located on Geary Boulevard near Park Presidio.  Lively area with lots of restaurants and exotic markets.  Close to the Presidio and Golden Gate Park.  Also close to the Golden Gate Bridge.,https://a0.muscache.com/pictures/prohost-api/Hosting-785698957007308545/original/8fd56f15-71f1-4a3b-8551-441f346e9936.jpeg,https://www.airbnb.com/users/show/91333416,Jan,22/08/2016,"Victoria, Canada",Sin datos,within an hour,100%,99.0,f,https://a0.muscache.com/im/pictures/user/9a2eb563-3a2a-429f-be95-413c035cd29a.jpg?aki_policy=profile_small,https://a0.muscache.com/im/pictures/user/9a2eb563-3a2a-429f-be95-413c035cd29a.jpg?aki_policy=profile_x_medium,Eureka Valley,"['email', 'phone']",t,t,"San Francisco, California, United States",Inner Richmond,Entire rental unit,Entire home/apt,1 bath,"[""Carbon monoxide alarm"", ""Hangers"", ""Iron"", ""Shampoo"", ""Dedicated workspace"", ""TV with standard cable"", ""Hair dryer"", ""Smoke alarm"", ""Fire extinguisher"", ""Wifi"", ""Heating"", ""Kitchen""]",25000.0,t,06/03/2023,Sin datos,Sin datos,Sin datos,t,27790615.3,20200000000000.0,91333416.0,32.0,50.0,37.78109073,-122.4723304,4.0,2.0,2.0,30.0,182.0,30.0,30.0,182.0,182.0,30.0,182.0,30,60,90,364,0.0,0.0,0.0,4.8,4.8,4.8,4.9,4.9,4.8,4.7,3.5,1.1,0.0,0.0,1.3
